{
  "schema_version": "v1",
  "briefing_type": "github-curator",
  "generated_at": "2026-05-28T06:00:00+00:00",
  "date": "2026-05-28",
  "candidate_pool_size": 100,
  "active_curators_today": ["@simonw", "@karpathy", "@GitTrend0x"],
  "fallback_layer_used": "layer1",
  "top_repos": [
    {"repo_url": "https://github.com/microsoft/qlib", "stars": 15234, "language": "Python", "topic_tags": ["quant","ml","finance"], "mention_count": 3, "mentioners": ["@simonw","@karpathy","@GitTrend0x"], "first_mention_at": "2026-05-28T13:22:00+00:00", "score": 0.87, "summary": "Qlib 是微软开源的量化金融研究平台，覆盖从原始数据采集、特征工程、模型训练到回测评估的完整链路，支持自定义模型插件。", "use_case": "你需要在 Python 项目里搭建量化研究 pipeline；或公司内做 alpha 因子研究需要可复现 baseline。不适用于纯加密货币高频交易。"},
    {"repo_url": "https://github.com/vercel/next.js", "stars": 124000, "language": "TypeScript", "topic_tags": ["react","nextjs"], "mention_count": 2, "mentioners": ["@rauchg","@leeerob"], "first_mention_at": "2026-05-28T10:15:00+00:00", "score": 0.81, "summary": "Next.js 是 React 全栈框架，提供 SSR/SSG/RSC、文件路由、API routes 等开箱即用的能力，主要面向生产级 web 应用。", "use_case": "你要构建生产级 React 应用，需要 SSR 或边缘渲染支持。如果只是 SPA 单页应用且无 SEO 需求，原生 Vite 更轻量。"},
    {"repo_url": "https://github.com/shadcn-ui/ui", "stars": 78000, "language": "TypeScript", "topic_tags": ["ui","react","tailwind"], "mention_count": 2, "mentioners": ["@shadcn","@cassidoo"], "first_mention_at": "2026-05-28T09:00:00+00:00", "score": 0.76, "summary": "shadcn/ui 是基于 Radix UI + Tailwind 的可复制粘贴组件集合，源码直接进项目而非作为 npm 依赖。", "use_case": "你想要可完全 own 组件代码、按需修改样式而不被锁在某个 design system 里。不适合纯 webpack 老项目（依赖现代 Tailwind/CSS 体系）。"},
    {"repo_url": "https://github.com/langchain-ai/langgraph", "stars": 12500, "language": "Python", "topic_tags": ["agent","llm","framework"], "mention_count": 2, "mentioners": ["@hwchase17","@simonw"], "first_mention_at": "2026-05-28T08:30:00+00:00", "score": 0.74, "summary": "LangGraph 是 LangChain 团队推出的多 agent 编排框架，提供状态图建模、循环、人在回路等能力。", "use_case": "你要做复杂多步 agent 工作流，需要持久状态和回滚。简单单轮 prompt 任务用裸 OpenAI SDK 就够了。"},
    {"repo_url": "https://github.com/jerryjliu/llama_index", "stars": 36000, "language": "Python", "topic_tags": ["rag","llm","data"], "mention_count": 2, "mentioners": ["@jerryjliu0","@simonw"], "first_mention_at": "2026-05-28T07:45:00+00:00", "score": 0.72, "summary": "LlamaIndex 是面向 RAG 应用的数据框架，提供 indexing、retrieval、query engine 等模块。", "use_case": "你要在自有文档上做 RAG 问答，需要灵活的 chunking 和 retrieval 策略。如果只是基本向量搜索，pinecone/chroma SDK 更直接。"},
    {"repo_url": "https://github.com/anthropics/anthropic-sdk-python", "stars": 1850, "language": "Python", "topic_tags": ["llm","sdk","claude"], "mention_count": 1, "mentioners": ["@alexalbert__"], "first_mention_at": "2026-05-28T11:00:00+00:00", "score": 0.69, "summary": "Anthropic 官方 Python SDK，封装 Claude API 调用、tool use、流式输出、prompt caching 等。", "use_case": "你在 Python 里调用 Claude API。如果只用 1-2 个端点，直接 requests 也可以；SDK 优势在 stream/tool use 的封装。"},
    {"repo_url": "https://github.com/openai/openai-python", "stars": 22000, "language": "Python", "topic_tags": ["llm","sdk","openai"], "mention_count": 1, "mentioners": ["@OfficialLoganK"], "first_mention_at": "2026-05-28T12:30:00+00:00", "score": 0.66, "summary": "OpenAI 官方 Python SDK，覆盖 chat completions、embeddings、assistants、batch、files、images 等全部 API。", "use_case": "你用 OpenAI 任何模型。无脑装，国内访问需要 base_url 走中转。"},
    {"repo_url": "https://github.com/microsoft/autogen", "stars": 32000, "language": "Python", "topic_tags": ["agent","multi-agent","framework"], "mention_count": 1, "mentioners": ["@matthewberman"], "first_mention_at": "2026-05-28T11:45:00+00:00", "score": 0.63, "summary": "AutoGen 是微软的多 agent 对话框架，让多个 LLM agent 通过对话协作完成任务。", "use_case": "你要做需要多角色协作的复杂任务（如代码评审 + 修复 + 测试）。单 agent 任务用 LangChain/原生 SDK 即可。"},
    {"repo_url": "https://github.com/openinterpreter/open-interpreter", "stars": 51000, "language": "Python", "topic_tags": ["llm","code-exec","interpreter"], "mention_count": 1, "mentioners": ["@LiorOnAI"], "first_mention_at": "2026-05-28T10:00:00+00:00", "score": 0.60, "summary": "Open Interpreter 让 LLM 在本地执行代码（Python/JS/Shell），实现自然语言驱动的本地任务自动化。", "use_case": "你想让 AI 帮你跑数据处理、文件批改、系统脚本，且本地需要执行权限。生产环境千万别开（沙箱绕过风险）。"},
    {"repo_url": "https://github.com/exo-explore/exo", "stars": 17000, "language": "Python", "topic_tags": ["distributed","llm","inference"], "mention_count": 1, "mentioners": ["@levelsio"], "first_mention_at": "2026-05-28T09:30:00+00:00", "score": 0.58, "summary": "Exo 让你把多台家用设备（iPhone/iPad/Mac）拼成一个分布式 LLM 推理集群，跑 Llama 70B 这种大模型。", "use_case": "你有多台闲置 Apple 设备想跑大模型本地推理，不想买专门 GPU 机。单设备够用或追求低延迟则不必。"}
  ]
}
